{
  "schemaVersion": 1,
  "id": "extension-domain-action",
  "title": "Extension-Authored Domain Action",
  "intent": "Wrap semantic and graphical primitives inside one traceable extension action with explicit ownership and materialization.",
  "useWhen": [
    "Use this recipe when an extension author must add a domain operation not provided by the ordinary chart-authoring API."
  ],
  "avoidWhen": [
    "Avoid this recipe for ordinary charts that can be expressed with existing domain actions, facades, or focused edits."
  ],
  "prerequisites": [
    "Provide immutable row objects containing every field named by the selected actions and example program.",
    "Use explicit public resource identifiers whenever current program state contains more than one compatible candidate."
  ],
  "inputs": [
    {
      "name": "values",
      "description": "An array of plain row objects containing the fields required by this task.",
      "required": true
    },
    {
      "name": "options",
      "description": "Task-specific field names, resource identifiers, and supported visual or statistical choices.",
      "required": false
    }
  ],
  "outcomes": [
    "Wrap semantic and graphical primitives inside one traceable extension action with explicit ownership and materialization."
  ],
  "steps": [
    {
      "id": "author-primary-result",
      "instruction": "Apply the primary action that produces the recognizable extension-authored domain action result or workflow.",
      "actions": [
        {
          "name": "createGraphics",
          "role": "primary"
        }
      ]
    },
    {
      "id": "add-supporting-variants",
      "instruction": "Choose only the focused extension-authored domain action components required by the task; mutually exclusive creation alternatives are demonstrated as independent chart variants.",
      "actions": [
        {
          "name": "editSemantic",
          "role": "supporting"
        }
      ]
    },
    {
      "id": "revise-or-remove-owned-state",
      "instruction": "Use the focused lifecycle actions only after their owned extension-authored domain action resources exist and are uniquely targeted.",
      "actions": [
        {
          "name": "editGraphics",
          "role": "lifecycle"
        }
      ]
    }
  ],
  "alternatives": [
    {
      "when": "Choose a neighboring recipe when its stated result and data roles match the requested chart more directly.",
      "instruction": "Prefer one complete domain facade or task recipe before composing lower-level actions manually.",
      "actions": []
    }
  ],
  "pitfalls": [
    {
      "problem": "Implicit targeting fails when several compatible datasets, marks, scales, guides, or owners exist in the same program.",
      "fix": "Pass the exact public identifier named by the action signature instead of relying on first-resource selection."
    }
  ],
  "example": {
    "path": "test/llm/recipe-knowledge-examples.js",
    "export": "recipeExamples"
  },
  "relatedRecipes": [],
  "docs": [
    {
      "path": "docs/extension/action-authoring.md"
    }
  ]
}
