{
  "schemaVersion": 1,
  "id": "rose-chart",
  "title": "Rose Chart",
  "intent": "Create equal-angle Polar sectors whose radial lengths compare quantitative magnitudes across categories.",
  "useWhen": [
    "Use this recipe when a cyclic or radial category arrangement materially supports the comparison."
  ],
  "avoidWhen": [
    "Avoid this recipe when ordinary Cartesian bars would provide more accurate and familiar magnitude comparison."
  ],
  "prerequisites": [
    "Provide immutable row objects containing every field named by the selected actions and example program.",
    "Use explicit public resource identifiers whenever current program state contains more than one compatible candidate."
  ],
  "inputs": [
    {
      "name": "values",
      "description": "An array of plain row objects containing the fields required by this task.",
      "required": true
    },
    {
      "name": "options",
      "description": "Task-specific field names, resource identifiers, and supported visual or statistical choices.",
      "required": false
    }
  ],
  "outcomes": [
    "Create equal-angle Polar sectors whose radial lengths compare quantitative magnitudes across categories."
  ],
  "steps": [
    {
      "id": "prepare-required-state",
      "instruction": "Create the data, marks, encodings, and owned resources required before authoring the rose chart result.",
      "actions": [
        {
          "name": "createCanvas",
          "role": "supporting"
        },
        {
          "name": "createData",
          "role": "supporting"
        }
      ]
    },
    {
      "id": "author-primary-result",
      "instruction": "Apply the primary action that produces the recognizable rose chart result or workflow.",
      "actions": [
        {
          "name": "createArcMark",
          "role": "primary"
        }
      ]
    },
    {
      "id": "add-supporting-variants",
      "instruction": "Add only the supporting encodings, marks, and owned resources needed for the requested rose chart variant.",
      "actions": [
        {
          "name": "encodeTheta",
          "role": "supporting"
        },
        {
          "name": "encodeR",
          "role": "supporting"
        },
        {
          "name": "encodeColor",
          "role": "supporting"
        }
      ]
    }
  ],
  "alternatives": [
    {
      "when": "Choose a neighboring recipe when its stated result and data roles match the requested chart more directly.",
      "instruction": "Prefer one complete domain facade or task recipe before composing lower-level actions manually.",
      "actions": []
    }
  ],
  "pitfalls": [
    {
      "problem": "There is no createRoseChart facade that constructs this radial chart family in one call.",
      "fix": "Use createArcMark followed by encodeTheta, encodeR, and encodeColor as shown in the executable source."
    },
    {
      "problem": "Implicit targeting fails when several compatible datasets, marks, scales, guides, or owners exist in the same program.",
      "fix": "Pass the exact public identifier named by the action signature instead of relying on first-resource selection."
    }
  ],
  "example": {
    "path": "examples/nightingale-rose-chart/program.js",
    "export": "createNightingaleRoseChart"
  },
  "relatedRecipes": [
    "mark-lifecycle"
  ],
  "docs": [
    {
      "path": "docs/recipes/rose-chart.md"
    }
  ]
}
