{
  "schemaVersion": 1,
  "id": "violin-plot",
  "title": "Violin Plot",
  "intent": "Create compact mirrored density profiles for comparing quantitative distributions across categorical groups.",
  "useWhen": [
    "Use this recipe when several group distributions need shape comparison in aligned categorical slots."
  ],
  "avoidWhen": [
    "Avoid this recipe when quartiles and outliers are more important than the smoothed distribution shape."
  ],
  "prerequisites": [
    "Provide immutable row objects containing every field named by the selected actions and example program.",
    "Use explicit public resource identifiers whenever current program state contains more than one compatible candidate."
  ],
  "inputs": [
    {
      "name": "values",
      "description": "An array of plain row objects containing the fields required by this task.",
      "required": true
    },
    {
      "name": "options",
      "description": "Task-specific field names, resource identifiers, and supported visual or statistical choices.",
      "required": false
    }
  ],
  "outcomes": [
    "Create compact mirrored density profiles for comparing quantitative distributions across categorical groups."
  ],
  "steps": [
    {
      "id": "prepare-required-state",
      "instruction": "Create the data, marks, encodings, and owned resources required before authoring the violin plot result.",
      "actions": [
        {
          "name": "createCanvas",
          "role": "supporting"
        },
        {
          "name": "createData",
          "role": "supporting"
        }
      ]
    },
    {
      "id": "author-primary-result",
      "instruction": "Apply the primary action that produces the recognizable violin plot result or workflow.",
      "actions": [
        {
          "name": "createViolinPlot",
          "role": "primary"
        }
      ]
    }
  ],
  "alternatives": [
    {
      "when": "Choose a neighboring recipe when its stated result and data roles match the requested chart more directly.",
      "instruction": "Prefer one complete domain facade or task recipe before composing lower-level actions manually.",
      "actions": []
    }
  ],
  "pitfalls": [
    {
      "problem": "Implicit targeting fails when several compatible datasets, marks, scales, guides, or owners exist in the same program.",
      "fix": "Pass the exact public identifier named by the action signature instead of relying on first-resource selection."
    }
  ],
  "example": {
    "path": "examples/cars-acceleration-violins/program.js",
    "export": "createCarsAccelerationViolins"
  },
  "relatedRecipes": [],
  "docs": [
    {
      "path": "docs/recipes/violin-plot.md"
    }
  ]
}
